job_id,published_on,updated_on,role,company,slug,link,description,tags
68271,2017-10-11T07:57:25,2017-10-11T05:29:13,"Frontend Developer (JavaScript, React/Redux/Angular, ES6)",VAI,frontend-developer-javascript-reactreduxangular-es6-vai,http://berlinstartupjobs.com/engineering/frontend-developer-javascript-reactreduxangular-es6-vai/,"VAI – the cashflow revolution
VAI helps SMEs finance their stock and is transforming the way SMEs do business.
Paying with VAI lets buyers control the terms on almost everything they buy for their stock. It’s a cash flow revolution for the millions of (German) SMEs.

You are a technology expert, entrepreneurship enthusiast and coder with heart? You have know-how in constructing, maintaining and scaling advanced IT-architecture, have already developed machine learning concepts and implemented those? In addition, you are keen to solve current challenges faced by commercial banking? Great, we are looking for YOU!
We are a young, well-funded FinTech in the heart of Berlin. Focusing on B2B, we aim to improve and diversify financing opportunities for SMEs by applying a smart, technology-driven approach.
Your Profile

1+ years of experience, preferably in the field of startups
University degree with a tech background is an advantage, but no requirement if you could acquire the relevant skills with private projects
Good tech skills, especially when it comes to topics such as JavaScript ES6 Frameworks (React, Angular, Redux), Webpack, SASS Design, responsive web design
Experience with agile processes (scrum, kanban)
Hands-on, you are always on the lookout for the best solution – also if it requires independently diving into new topics
Next to tech you have a few more hobbies ;)
Fluent in English and German would be an advantage
You are a self-starter and enjoy working in a team

Your Challenges:

Build UI applications using modern JS frameworks such as React, Angular, Redux.
Contribute to developing new architecture of the frontend application
Develop a responsive user interface while working directly with our Design team
Prototype new concepts along with design and product management team
Develop and maintain test suites
Learn and share things you are passionate about

What we offer

Unique opportunity to shape your own path – We truly look for an ‘Allstar’.
You will be part of the core team of our young and talented characters at the heart of Berlin
You will work side by side with our venture partners and gain exciting insights into all phases of founding a startup and have access to our versatile network of companies
Fun even without a table soccer ;)

If you like what you read, reach out to us! We want to get to know you!
","[28, 4016, 4659, 14115, 15049]"
68270,2017-10-11T07:45:22,2017-10-11T05:28:25,DevOps Engineer (m/f),Snom Technology GmbH,devops-engineer-mf-snom-technology-gmbh,http://berlinstartupjobs.com/engineering/devops-engineer-mf-snom-technology-gmbh/,"Founded in 1997 and headquartered in Berlin, Snom is a German multinational corporation and the world’s first and leading brand of professional enterprise VoIP telephones. Our engineering is globally renowned for high quality and feature-rich business telephones that are universally compatible with leading Unified Communications platforms worldwide. Snom products are sold to over 25,000 Snom Value Added Resellers across the world.

You are based in Berlin working full-time on a permanent contract.
Your tasks:
Do you want to shape the business intelligence data with new technology-driven processes? Do you enjoy taking a proactive and holistic approach that will propose solutions for existing problems not yet solved? You will be encouraged to propose new ideas, improve existing processes, and take initiative to develop Snom’s operations and infrastructure processes.
You perform on a key role that will scale up the business by automation of workflow processes and solutions for high-availability services. With your support you will help teams in sales, finance, IT, development and BI to make informed business decisions and faster delivery of VoIP solutions to new and existing clients.
Automation:

Work with Information Technology to develop and execute Snom’s information technology operations
Use Python, Bash, and other scripting languages to automate workflows and streamline operations processes, developing new processes or improving on existing
Streamline Amazon Web Services deployment and operations tasks

Development:

Maintain and improve continuous integration and build system environment used in our Scrum process
Cooperate with IT and Software Development to further automate and streamline the development process. Refine and develop automatic deployment and maintenance processes for customer-facing services

BI data: 

Assist in creation and refinement of Data Analytics systems for visualizing and analyzing data sets
Use MSSQL, Python or other tools to gather data, working with Business Intelligence to automate data collection and analysis

Your profile: 

A degree in technology, engineering and/or some years of relevant experience
Experience working in DevOps, Systems Engineering or Software Engineering in a Scrum environment
Excellent knowledge of Linux (Debian / Ubuntu) systems administration
Experience in writing scripts utilizing Python, bash, Ms SQL, Ansible, CloudFormation and more
Working knowledge of TCP/IP networking and understanding of basic network security
Excellent communication skills with fluency in English, German would be a plus
Familiarity and experience working with Amazon Web Services
Bonus skills: Workable understanding of web application security concepts and high-availability

What do we offer?

A challenging and diverse position at the VoIP pioneer with sustainable growth
An opportunity to learn and grow in an international, open-minded working environment with highly talented, smart and motivated colleagues
Working interdepartment with an Agile Team
Introductory and regular trainings in Berlin
A job that gives you independence, autonomy and the opportunity to develop and execute ideas
Flexible working hours and home office
Competitive salary, benefits like BVG ticket and company pension scheme (betriebliche Altersversorgung)
Friendly and upbeat environment with kicker table, lots of beverages and fresh fruit, a variety of team events with colleagues from all branches

Interested? 
We would love to hear from you! Please send your CV and a cover letter including your earliest possible starting date and your salary expectations to jobs@snom.com. Your contacts will be Patrick McCulley (IT) and Jenny Kaiser (HR).
More about us: 
https://www.snom.com/│ twitter.com/snom │ www.facebook.com/snom.VoIP.phones
","[65, 1562, 1816, 2420, 16650]"
68074,2017-10-11T07:31:21,2017-10-11T05:27:04,(Senior) Data Expert (m/f),etventure Corporate Innovation GmbH,senior-data-expert-mf-etventure-corporate-innovation-gmbh,http://berlinstartupjobs.com/engineering/senior-data-expert-mf-etventure-corporate-innovation-gmbh/,"“The most successful companies are customer centric on the outside and data centric on the inside”. As a Data Expert (m/f) you support our clients – ranging from midsize to large companies – to apply data science where the business impact is the greatest. Therefore, you should be able to combine your data experience with creativity as well as business expertise to build new great data driven businesses and solutions.
Enough of meaningless eCommerce optimization? Then join our team and create a sustained impact.

What you’ll do

Identification, conception and implementation of high-potential use cases of data science on the customer’s side
Professional communication and collaboration with top-tier decision makers
Development of data-based business models, portfolio and positioning strategies on a project basis
Technologies and Algorithms Screening for proof of concepts
Demand analysis and validation of business ideas with target groups according to design thinking and data science methods
Economic feasibility studies of business approaches
Support of product coordination of internal and external operational project teams

Your profile

Degree in business informatics, industrial engineering, business mathematics, physics, computer science or business administration
At least 3 years of operational experience in the area of data analytics, business intelligence or data-based business models
You have a distinct understanding of data and you are able to identify data use cases we implement by using design thinking and lean startup methods
You enjoy leading a team and bring with you experiences in employee coordination and employee planning
Experience with R, Python, Tensor Flow or similar tools is a plus
Willingness to travel
Independent and result-oriented approach to work

What awaits you at etventure?
You become an integral part of the etventure team, which consists of product managers, entrepreneurs, project managers, design specialists, and marketing experts. You accompany the product concept, implementation and acceptance.
If you need guidance or have any questions about our hiring processes, please contact Lynn via e-mail lynn.basel@etventure.com
","[65, 523, 21190]"
68030,2017-10-10T13:45:43,2017-10-10T13:45:43,WORKING STUDENT ANDROID APP DEVELOPER (m/f),FOOLOGRAPHY,working-student-android-app-developer-mf-foolography,http://berlinstartupjobs.com/engineering/working-student-android-app-developer-mf-foolography/,"You love coding and are looking for the right opportunity to become part of something exceptional? You want to build amazing products that make the lives of photographers easier every day? You want to be part of a tech company that is changing an entire market? Then join our team.

THE OPPORTUNITY
186.723€ on Kickstarter. Over 300% more than what we needed. With our newest product “UNLEASHED” foolography became one of the most interesting hardware startups in Berlin, moving the worldwide photography market forward. Working on the UNLEASHED and with many more exciting products in the pipeline, we want to build a strong team willing to not only build high quality gadgets for photographers, but also help move the dusty photography market into a bright future: Improving how you shoot photos, optimizing photography workflows and providing new opportunities to be creative.
For our team in Berlin we’re looking for a working student for Android development. Between 10-20 hours per week, full-time in semester break if possible.
FOOLOGRAPHY is a small hardware company in the heart of Berlin, founded in 2009. Keeping a startup mentality allows us to focus on creating extraordinary products for promising niche markets. Our mission has been to provide intelligent solutions to equip photographers all around the world. Our objectives along the way: finding and combining the right technical components that meet our highly set goals, reverse engineering and breaking down complex systems, building tiny, perfected products and apps that are fun to use and create a real benefit for those who use them.
WHAT EXCITES YOU?

Concepting and planning apps that will be used by thousands of photographers
Building cool interfaces for beautiful Android apps
Working together with senior developers to let you become a better engineer with every step you take

WHAT IT TAKES TO SUCCEED?

A heart for IT and excitement for the newest gadgets
Ability to realize smooth working interfaces for Android apps as a native Android developer
Experience with the Android studio
A passion for photography and experience with C is a plus! ;-)

WHAT WE OFFER:

Be an essential part of something new and big
Help revolutionize a niche market that is in need of game-changing products
Create things photographers all over the world will use on a daily basis
Enjoy a flat hierarchy as well as quick and uncomplicated decision-making
On top of that, we love to go to meetups, conferences and try out the newest taco store

WANT TO JOIN US? GO AHEAD AND APPLY!
If we’ve sparked your interest we’re looking forward to a short application with CV, overview of grades and any reference projects you’ve been part of. Please send this, including the internal reference number (ANWE1710), to us via email to job@foolography.com and we’ll get in contact with you for a personal interview.
","[29, 46, 58, 782, 1865, 15447, 16989]"
67971,2017-10-10T12:59:14,2017-10-10T12:55:59,Senior Software Developer in Test (iOS),Wire,senior-software-developer-in-test-ios-wire,http://berlinstartupjobs.com/engineering/senior-software-developer-in-test-ios-wire/,"We are looking for a motivated, fast learning Senior Software Test Developer with good programming, problem determination, and communication skills. The role will be supporting user story testing and automating in a high percentage of test cases for efficient CI processes. The successful candidate is someone who is passionate about quality improvement and is a team player. The applicant should have good knowledge of Java programming and a strong interest in iOS app testing.

About us
Wire is a European start-up building a modern, secure and open source privacy-focused communications experience. We are a Swiss company with a development center in Berlin, Germany. Our people come from a wide range of backgrounds, united by shared passion for communication, design and technology. www.wire.com
Benefits
When you join:
Work with experts, multicultural team from 20 nationalities, competitive salary, relocation support, career growth opportunities, beautiful office with a rooftop terrace in the heart of Berlin.
Day-to-day:
Functional programming languages, hardware of your choice, adjustable standing desks, high quality chairs, regular tech talks, developer meetups in the office, bike storage, table tennis, foosball, yoga, breakfasts and lunches.
Responsibilities

Create and execute test cases for new stories
Automate and maintain test cases
Collaborate with the designers on spec and use cases
Be a part of the scrum team and scrum meetings
Find, troubleshoot, investigate bugs and log them in Jira
Share insights and bugs with the other QA members
Support CS on escalated problems
Report the testing progress and bugs status
Be a quality gate keeper of the releases
Coach and guide junior teammates on work assignment and problems solving

Requirements

5+ years experience in software testing
Good knowledge of Java
Previous experience with automation and CI
Advanced user of Jira
Previous experience in shipping native apps for iOS
Proactive and open minded person with the ability to think critically
Good analytical skills and willingness to track down root causes of issues

Education
Bachelor’s degree is required; technical degree preferred
Please apply here: https://short.sg/j/1416737 
","[58, 93, 275, 289, 2420]"
67961,2017-10-10T12:17:08,2017-10-10T11:32:13,Android Developer,AI Engine,android-developer-ai-engine,http://berlinstartupjobs.com/engineering/android-developer-ai-engine/,"Passionate Android Developer? Join Us! Just drop a mail via …

AI Engine is developing innovative machine learning components to solve future problems. Founded in 2017 we are an experienced team backed with several fundings.
Located in Berlin/Mitte, we are looking for a Android Developer who is excited about building Apps and being comfortable working within a small and fast-paced environment.
You will be responsible for developing our Android Apps. We need someone who can quickly adapt to shifting approaches, situations, and priorities.
Role

Build a new android app
Work closely with our product managers and backend developers
Be involved in all the relevant new product ideas and, in the creation and implementation of a perfect customer solution in a timely manner
Identification, testing, and fixing of all performance issues
Help us follow all the current and emerging mobile trends and technologies

Requirements

Working experience in Android development
Deep understanding of Android, Material Design and Mobile UI/UX
High proficiency in English

If you are curious what we do just send us some lines about you via contact@AIengine.tech
","[29, 46, 278, 1865]"
67807,2017-10-10T07:55:00,2017-10-10T06:52:22,Woocommerce Developer,Fitz &#038; Huxley GmbH,woocommerce-developer-fitz-huxley-gmbh,http://berlinstartupjobs.com/engineering/woocommerce-developer-fitz-huxley-gmbh/,"In order to reinforce the basis for our growth we are looking for a experienced developer for our Woocommerce-based shop system as well as for automizing workflows by leveraging IT.

We are looking for a full-stack developer with CTO-potential in mid term, to start as soon as possible (in the beginning as freelancer of part-time-employee).
Since 2015 we, Fitz & Huxley, dedicated ourselves to the design of fine, but functional backpacks that fit perfectly to every outfit (we are convinced that backpacks do not only have to be streetwear!). We combine minimalistic design, high quality and natural materials with great attention to functional details. Our backpacks are lasting, loyal partners for small and big urban adventures and every time an individual statement for taste and style – designed in Berlin. We are rapidly expanding and you can be a part of it! Have a look at our website www.fitzandhuxley.com Our office is located at Storkower Straße, Berlin.
Your tasks/projects include:

Develop multilingual woocommerce-based website that caters to the specific online marketing needs per country
Optimize website performance and do bugfixing
Optimize performance marketing tracking and -with expanding product portfolio- lay the basis for dynamic advertising
Overall responsibility for the flawless work of front-end, back-end and ERP-system
Develop software tools in order to optimize work-flows

What we offer?

You will be are part of a small, young team in a fast growing fashion label and your work will have a significant impact, thereby shaping the future of Fitz & Huxley.
We are having fun at work and so will you in one of the most exciting cites in the world.

Just send us an email to Lars at lars.messmann@fitzandhuxley.com with a few words about yourself, your motivation, as well as your availability. Please also attach your current CV and all relevant certificates in pdf format. We are looking forward to your application!
","[1599, 3541]"
67520,2017-10-10T07:35:09,2017-10-10T06:50:41,ASP.net Development,WAPPVISION GmbH,asp-net-development-wappvision-gmbh,http://berlinstartupjobs.com/engineering/asp-net-development-wappvision-gmbh/,"Werde Teil der WAPPVISIONären & hack mit uns die krassesten Visionen, deine Zukunft & die Begeisterung unserer Kunden!
Wir suchen nach Brains, Nerds & Hackergirls, unkontrollierten Fantasieträumern

Du bist…

praxiserfahrener web- und c# entwickler/in
profi in JavaScript, CSS3 und HTML5, sowie den frameworks jQuery und bootstrap
experte/expertin im umgang mit dem .net framework, asp.net MVC und WebApi
mit teamarbeit mittels Git / TFS vertraut
jemand, der/die selbstständig und eigenverantwortlich arbeitet
motiviert und technikbegeistert
ein/e teamplayer/in
schon mal mit WebApps (Cordova, Ionic) oder dem framework AngularJS in berührung gekommen
bff mit google … oder stackoverflow
bereit, gemeinsam einen neuen standort aufzubauen

du teilst diese vision und wünscht dir eine erfüllung, bei der du deine programmier-skills unter beweis stellen kannst? wir sind gespannt auf DICH!
wir bieten dir…

flache hierarchien
flexible arbeitszeiten
abwechslungsreiche aufgaben
projekte in verschiedenen größenordnungen
spannende herausforderungen
ein geiles team
kaffee – soviel du trinken kannst
club mate
süßes & saures
eine reise ins hackerparadies
berlin, würzburg, dinkelsbühl

get-in-touch & join our team!
wir sind…

verrückte visionäre, die ihr ziel kennen und genau wissen was wir wollen
jeden tag im www – mal tauchen wir hinein und mal surfen wir nur an der oberfläche
veränderer der digitalen welt
entwickler von apps, websites und individueller software
ständig auf der suche nach motivierten mitarbeitern
hier, um viel zu erreichen und dafür brauchen wir – DICH!

","[30, 377, 1865, 2825, 6626]"
67459,2017-10-09T13:50:23,2017-10-09T11:33:50,Data Scientist (m/f),DCMN,data-scientist-mf-dcmn,http://berlinstartupjobs.com/engineering/data-scientist-mf-dcmn/,"Hey you! We are DCMN – we proudly made it to the 107th position of the overall ranking of the ‘Financial Times 1000 Europe’s innovate & fast-growing companies‘ – and out of 236 German companies, we came in at 25th place. Booyah! To keep us growing strong and international we are hiring for the best talents all over the world. Maybe you?

As a Data Scientist, you will help us to build advanced tools within a broad variety of fields, from applied machine learning and business analytics to artificial intelligence. You will be part of an amazing team working together to improve all facets of our business using data driven approaches.
Our requirements

At least one year experience in applied machine learning/business intelligence/business analytics in industry and preferably in marketing/ad-tech/e-commerce
Solid knowledge of at least one programming language (Python, Scala, Matlab, R, …)
Basic knowledge in modern Big Data technologies (Spark, Elasticsearch, Hadoop, …)
You choose the best tool for each problem (Jupyter, pandas, SparkSQL, Tensorflow, …)
SQL and databases are not unfamiliar to you
You know how to test hypothesis with Bayes
You are familiar with the Git workflow, code reviews, branches
You are eager to learn new things, you are constantly improving your skills, and your are not afraid of taking up challenges with new technologies
Your communication skills are very well developed and you like interacting with co-workers from other departments
You see the greater picture: connecting technical, product, and business strategies and requirements
Your are fluent in English

Among other things you will help us with

Improve our algorithms, including our targeting algorithms and TV marketing attribution algorithm by crunching our online and mobile marketing data
Support our clients to understand their users better by running various statistical analyses on survey data and using clustering algorithms to group users into different channels
Create customized reports and visualizations from a broad variety of marketing channels for various clients
Building Machine Learning tools to understand creativity and bring the creative team to the next level
Work closely together with other departments within the company and move them to the data driven world

What’s in it for you?

Work in a dynamic, experienced team of outstanding developers
Be a part of an elite international team – we have 30 nationalities!
Working with the latest technologies
Take full responsibility from day one
Home-office and remote work friendly, matched with flexible working hours.
We’re not cheap, you’ll get a nice screen or two
Free language courses, pilates classes and massages during and outside work time
We live work/life balance (!)
A recently remodelled and trendy office in a building with other great digital companies in one of the hottest neighborhoods in Berlin,
A competitive compensation and an incentive plan that rocks when you rock

Interested?
Does this job description sound perfect for you? We’d love to hear from you. Please send us your CV along with relevant documents and your earliest possible starting date. Don’t hesitate to contact us if you have any questions. Your contact person is Theresa Jasaraj (career@dcmn.com).
Please note: We prefer applications via our application form (click the ‘Apply’ button on this website). It really makes life easier for us and your application can be processed quicker.
","[100, 560, 893, 2402, 2598, 2601, 3079, 15421]"
67458,2017-10-09T13:45:22,2017-10-09T11:33:30,DevOps Engineer (Server/Backend),volatiles lighting GmbH,devops-engineer-serverbackend-volatiles-lighting-gmbh,http://berlinstartupjobs.com/engineering/devops-engineer-serverbackend-volatiles-lighting-gmbh/,"volatiles is a Berlin-based, fast growing IoT / Smart Lighting start-up that develops
the next generation of connected lighting technology. We combine deep tech with beautiful design. As our company grows, we move from a highly tech-centric to a more balanced team. We’re an ambitious bunch of strong individuals and passionate about building truly innovative products. Grow with us and shape our company in this exciting phase. volatiles is an equal opportunity employer, and all qualified applicants will be considered regardless of religion, gender, age and race. We look forward to receiving your application at jobs@volatiles.lighting
Direct link to job ad:
http://volatiles.lighting/career/volatiles%20jobs%20-%20DevOps%20Engineer.pdf

Your responsibilities:

Maintain and develop our backend while providing scalability
Create new business relevant services
Implement data processing on the server
Install and maintain a CMS
Maintain our customer and business databases
Implement integration of IoT services

Your background:

Management of Java or JavaScript based business software
Working knowledge of SQL and one common database technology,
such as Postgres, MySQL, MongoDB
Experience with at least one unit testing framework
Load balancing with nginx
CMS deployment and integration
Linux administration (Ubuntu)
Excellent command of written and spoken English. German is a plus, but not required
You are legally able to work in Germany. If you don‘t possess a work permit for Germany yet, let us know and we can assist you with the process

","[18, 21, 28, 58, 2099, 2188, 4098]"
