job_id,published_on,updated_on,role,company,slug,link,description,tags
66606,2017-10-05T12:45:58,2017-10-05T11:06:40,(Junior) Solution Developer,Emarsys,junior-solution-developer-emarsys,http://berlinstartupjobs.com/engineering/junior-solution-developer-emarsys/,"Du hast Spaß an technischen Herausforderungen? Du interessierst dich für Web Technologien? Und du hilfst gerne dabei, Neues auszuprobieren und zu verwirklichen?

Du hast Spaß an technischen Herausforderungen? Du interessierst dich für Web Technologien? Und du hilfst gerne dabei, Neues auszuprobieren und zu verwirklichen? Der Solutions Developer bündelt all das: Die Erstellung von Demos und Proof-of-Concept Webapplikationen, um neue Konzepte zu zeigen, gehört genauso zu den Aufgaben, wie eigene Ideen zu entwickeln um damit die Emarsys Produkte bereits im Sales-Prozess richtig zu positionieren.
DEINE AUFGABEN

Du unterstützt bei der Erstellung von funktionellen WebApps als Proof-of-Concept und bei innovativen Produktideen
Entwicklung von klickbaren Prototypen und Konzepten um Ideen zu Visualisieren und erfahrbar zu machen
Mitarbeit im Design, der Entwicklung und der Kommunikation für ansprechende Software-Demos in Form von Präsentationsmaterialien und Screenshots, die komplexe Software einfach begreifbar machen
Zusammenarbeit mit einem Team von erfahrenen Solution Consultants zur Erstellung von kundenspezifischen Präsentationen individueller Lösungen
Mitarbeit an innovativen Konzepten für abgestimmte Produktdemos, die sich an der Produktentwicklungs-Roadmap orientieren

DEIN PROFIL

Erste Erfahrung im Bereich Webentwicklung und Webtechnologien, JavaScript und PHP Kenntnisse
Erfahrung mit Software wie Adobe Creative Suite, PowerPoint/Prezi von Vorteil
Strategisches Denken und die Fähigkeit, Ideen in Konzepte umzusetzen und daraus strukturierte, visuell ansprechende Präsentationen und Lösungen zu erarbeiten
Gute Kommunikationsfähigkeiten für die Erstellung von Texten und Grafiken, sowie Liebe zum Detail
Freude an der Arbeit im Team
Erfahrung mit Software as a Service Lösungen ist ein Plus
Fließende Englischkenntnisse

WIR BIETEN

International aufgestelltes Unternehmen mit einer sehr guten Marktpositionierung
Anspruchsvolle und spannende Projekte für renommierte Kunden
Ausgereiftes Onboarding sowie internes Schulungsprogramm
Positive Arbeitsatmosphäre sowie Offenheit für neue Impulse und Ideen
Regelmäßige Teamevents, Company Breakfast sowie weitere Benefits
Sehr schönes Büro in zentraler Lage, direkt an der Spree

","[25, 28, 1599, 5593, 19752]"
66599,2017-10-05T12:40:37,2017-10-05T11:05:54,Fullstack Developer,Emarsys,fullstack-developer-emarsys,http://berlinstartupjobs.com/engineering/fullstack-developer-emarsys/,"Looking for a Fullstack PHP Developer who loves to write clean code and create a product experience your users enjoy every day

Do you want to make a real difference?
• You love to write clean code and create a product experience your users enjoy every day.
• You want to work with sharp, driven people like yourself, in an environment that gives you the freedom to grow and the ability to shine.
• You’d like to be part of a company which has “going the extra mile, with a smile” in its DNA.
…by doing what you love in a supportive environment?
• Developing highly scalable and sustainable web applications and services, in back-and frontend
• Create clever and creative individual customer solutions
• Consult our Account Management Team regarding technical questions
• Shaping user experience and driving product development
• Exploring new technologies which fit the challenges ahead
• Optimizing distributed services based on a modern cloud infrastructure
…for a company with kick-ass products & technology?
• Revolutionizing how companies communicate with their users, by enabling truly personal interactions for billions of contacts
• Only sending relevant messages, timed and targeted to perfection with our mobile messaging products, instead of the bulk marketing you get from brands around the world today
• Utilizing AI-driven automation solutions, based on big data insights and made available via an easy-to-use marketing platform
…living and working in one of the finest cities on earth?
• Berlin, Germany’s vibrant capital that has become Europe’s hub for talented techies from all around the world in recent years. It’s laid back, it’s cosmopolitan, has an open-minded culture, a creative spirit and a gigantic start-up scene
• Join people from over a dozen nations in our centrally located, modern offices
• Enjoy a dynamic approach, with small, independent, and cross-functional product development teams
Then take on responsibility in one of our teams, if…
• You have several years of experience working with PHP and MySQL, and good HTML skills
• You consider your tasks complete when your solutions are operational, documented, tested, and can be rolled out automatically.
• You’re committed to simple solutions and getting things done
• You have a work permit for Germany
• You speak English fluently and ideally have at least basic German skills as well
We offer you…
• A reliable team with clear objectives, experienced leads, and strong technical backgrounds
• A place where you can continuously improve yourself by working with talented and easy-going colleagues
• Recognition for your commitment and precise work
• Additional benefits such as sports, team and company events, various healthcare activities, free coffee and fresh fruits daily
","[25, 282, 4399, 4897]"
66592,2017-10-05T12:35:36,2017-10-05T11:04:58,Contract JavaScript Engineer,Impala,contract-javascript-engineer-impala,http://berlinstartupjobs.com/engineering/contract-javascript-engineer-impala/,"Join a Berlin based TechStars company building the future of smart hotels.

Impala is looking to hire a javascript engineer on a short term contract basis (1-3 months) to help us build the technology that powers smart hotels. You’ll be joining a small but extremely ambitious team, that has achieved our first year sales targets two months after demonstrating our beta. You’ll be working directly on building new functionality into the product as well as working on existing features.
We work with a NodeJS/GraphQL backend (on top of Postgres).
A JS Engineer at Impala:

Takes ownership of features working on all aspects of Impala.
Spends time working on tooling to fix our common problems. In the past this has involved building chrome extensions and open source libraries.
Has a direct input in the formulation of functionality.

We’re currently going through the Metro/TechStars Accelerator in Berlin and are looking for someone available in the area or who are willing to temporarily relocate (at our expense).
Skills & Requirements
We’re looking for engineers who are genuinely interested in using the latest web technologies when they’re available. We’re also looking for people who can build things well and also like to ship.
You won’t be asked about linked lists or binary search trees in your interview but you will be asked about ES6 and APIs that you’ve worked with.
What we need to see:

Experience with ReactJS
Experience in Node
Experience with relational databases (Postgres preferable)
An interest in taking ownership of functionality

What we’d love to see:

Experience with Redux or significant experience with ReactJS
Experience with GraphQL
Experience with an ORM

","[28, 17158]"
66342,2017-10-05T08:55:05,2017-10-05T08:38:48,App Entwickler (Multiplattform),Kinematics GmbH,app-entwickler-multiplattform-kinematics-gmbh,http://berlinstartupjobs.com/engineering/app-entwickler-multiplattform-kinematics-gmbh/,"Ab sofort suchen wir nach einem begeisterungsfähigen Softwareentwickler(in) mit Schwerpunkt App-Entwicklung (Multiplattform) für unser Office im Herzen von Berlin,
die/der unser Berliner Team bei der Weiterentwicklung unseres Produktes unterstützt.

App Entwickler (Multiplattform)
Über uns:
Wir sind ein vielfach ausgezeichnetes Start-up mit Sitz in Bernau und in Berlin.
Mit unserem jungen, humorvollen Team entwickeln, produzieren und vermarkten wir voller Begeisterung ein einzigartiges Robotik-Baukastensystem.
www.tinkerbots.com
Ab sofort suchen wir nach einem begeisterungsfähigen Softwareentwickler(in) mit Schwerpunkt App-Entwicklung (Multiplattform) für unser Office im Herzen von Berlin,
die/der unser Berliner Team bei der Weiterentwicklung unseres Produktes unterstützt.
Deine Aufgaben:

Test und Dokumentation der entwickelten Applikationen
Breites Aufgabenspektrum innerhalb hoch innovativer und spannender Themen rund um das Thema Robotik
Unterstützung des App-Teams sowie eigenverantwortliche Umsetzung von Apps zur Fernsteuerung & Programmierung unserer Robotik-Module

Dein Profil:

Mehrjährige Erfahrung als JavaScript-Entwickler oder Erfahrungen mit ähnlichen Technologien und hoher Lernbereitschaft für JavaScript
Kenntnisse in der Entwicklung komplexer Lösungen mit TypeScript
Idealerweise Erfahrungen mit dem iOS SDK / Android SDK
Ein Auge für hochwertiges Design, gute Usability und sauberen Code
Kenntnisse über Architekturstandards, Best Practices (z.B. Design Patterns)
Sicherer Umgang mit gängigen Tools für die Software-Erstellung
Ergebnisorientierung, Kommunikations- und Teamfähigkeit
Du hast gute Deutsch und Englischkenntnisse (in Wort und Schrift)
Erfahrung mit der Integration von Web-Diensten ist von Vorteil
Ein abgeschlossenes Studium ist kein Muss, aber von Vorteil
Du wohnst idealerweise im Raum Berlin

Wir bieten Dir eine spannende Position in einem jungen Hardware-Unternehmen
verbunden mit der Möglichkeit auf eigenverantwortliche und gestaltende Mitarbeit in einem tollen Team. Abwechslungsreiche Aufgaben, flache Hierarchien, eine offene Kommunikation sowie viel Freiraum zur Entfaltung warten auf Dich. Wir bieten zudem eine attraktive Vergütung inkl. Boni und langfristige Perspektiven.
Haben wir Dein Interesse geweckt? Dann schreibe uns eine Mail (bitte mit kurzem Lebenslauf und wenn möglich mit einer kleinen Referenzliste deiner Projekte) an jobs@tinkerbots.com
Kinematics GmbH • Spreeallee 2 • 16321 Bernau bei Berlin
","[773, 1816, 1865]"
66379,2017-10-05T08:47:54,2017-10-05T07:46:25,Backend Software Engineering &#8211; all levels,99chairs,backend-software-engineering-all-levels-99chairs,http://berlinstartupjobs.com/engineering/backend-software-engineering-all-levels-99chairs/,"Are you looking for the next step in your career?
Then join our team of talented entrepreneurs right in the heart of the startup capital Berlin!
We believe in bringing happiness to people through interior designs that turn their homes and offices into places they love.
In our pursuit to innovate living, we deliver exceptional & affordable interior design solutions. Whether our clients are looking for design inspiration or want us to bring the ideas to life ourselves, we strive to make their experience as convenient & inspirational as humanly possible – and, by the way, that’s only where we start!
We pride ourselves in the service we deliver. And, we value the people that turn our mission into a reality. Our dream is to create a work environment that connects great talent, gives them the freedom to do great stuff and continuously supports opportunities for learning and growth. At 99chairs, colleagues turn into friends and goals are accomplished as a team.

The role

Help 99chairs build a robust and scalable backend API that enables our front-end applications (website and mobile).
Planning and development of back-end system with strong emphasis on code quality and structure.
Responsible for designing and architecturing the back-end application.
Dive into hard problems and successfully deliver great results on schedule
Work closely with product managers, designers & other engineering team members to roll out new features and improve existing ones.
Integration with 3rd Party APIs and systems.

Your skills and experience

Professional hands-on experience in software development specially back-end development.
Ability to write clean and modular code with emphasis on code quality.
Good experience writing automated unit and integration test cases.
Experience building and deploying complex web platforms and APIs.
Knowledge about the various software engineering practices,concepts and tools used in professional software development like code reviews, version control, build processes, continuous integration, test automation etc.
Our tech stack includes: Ruby, Ruby on Rails, ElasticSearch, Redis, Docker amongst other. Experience in these technologies (although not mandatory) is highly desirable.
Experience working in any Object Oriented language that’s used for web application development.
Ability to take ownership for your work and work independently.
Strong analytical and problem solving skills.

More reasons to work at 99chairs

A flat work environment with innovative decision making processes. We don’t just say this, but do our very best to make sure that everyone’s voice is being heard.
Flexible work hours and environment. As long as you get things done and are aligned with your team, you have complete autonomy over your work-life.
A kitchen fully stocked with healthy snacks & drinks as well as weekly team lunches.
A BVG ticket to brighten up your commute
The possibility to furnish your home with our amazing discount rates.

Are you the right fit?
We are looking for people that are smart entrepreneurs at heart, who love responsibility and bring projects and ideas forward – every single day. We love constant learners, team players, and people who agree that strong teams are built based on honesty!
Interested?
Then submit your application including cover letter, CV, grades and references by clicking on the button below. We can’t wait to get to know you!
*99chairs is an equal opportunity employer. Applicants are considered without regards to race, color, religion, national origin, age, sex, marital status, ancestry, physical or mental disability, veteran status, gender identity, or sexual orientation.
","[28, 51, 133, 19369]"
66386,2017-10-05T08:45:53,2017-10-05T07:45:07,Frontend Software Engineering- all levels,99chairs,frontend-software-engineering-all-levels-99chiars,http://berlinstartupjobs.com/engineering/frontend-software-engineering-all-levels-99chiars/,"Are you looking for the next step in your career?
Then join our team of talented entrepreneurs right in the heart of the startup capital Berlin!
We believe in bringing happiness to people through interior designs that turn their homes and offices into places they love.
In our pursuit to innovate living, we deliver exceptional & affordable interior design solutions. Whether our clients are looking for design inspiration or want us to bring the ideas to life ourselves, we strive to make their experience as convenient & inspirational as humanly possible – and, by the way, that’s only where we start!
We pride ourselves in the service we deliver. And, we value the people that turn our mission into a reality. Our dream is to create a work environment that connects great talent, gives them the freedom to do great stuff and continuously supports opportunities for learning and growth. At 99chairs, colleagues turn into friends and goals are accomplished as a team.

The role

Work closely with product managers, designers & other engineering team members to roll out new features and improve existing ones
Implement great client side UI, with focus on clean and modular code
Mentoring other team members and interns
Testing of the front-end code using Javascript tests
Keeping our application and libraries updated and using best engineering practices

Your skills & experience

You’re an expert with JavaScript, with focus on good code quality and principles
You know how to scale web platforms, including optimizations and browser or device specific adjustments
Experience with JS frameworks such as React
Comfortable with Git, Unix and dealing with REST-APIs
Our tech stack includes: Ruby on Rails, React, Node.js etc. Experience in these technologies (although not mandatory) is highly desirable.
Focused on building responsive interfaces
Always up-to-date with latest trends, tools and technologies in the front-end world
Experience with front-end testing using Jasmine, Karma etc.
Familiar with SEO principles
Hands-on experience working with backend tools and technologies such as Node.js or Ruby on Rails is a plus

More reasons to work at 99chairs

A flat work environment with innovative decision making processes. We don’t just say this, but do our very best to make sure that everyone’s voice is being heard.
Flexible work hours and environment. As long as you get things done and are aligned with your team, you have complete autonomy over your work-life.
A kitchen fully stocked with healthy snacks & drinks as well as weekly team lunches.
A BVG ticket to brighten up your commute
The possibility to furnish your home with our amazing discount rates.

Are you the right fit?
We are looking for people that are smart entrepreneurs at heart, who love responsibility and bring projects and ideas forward – every single day. We love constant learners, team players, and people who agree that strong teams are built based on honesty!
Interested?
Then submit your application including cover letter, CV, grades and references by clicking on the button below. We can’t wait to get to know you!
*99chairs is an equal opportunity employer. Applicants are considered without regards to race, color, religion, national origin, age, sex, marital status, ancestry, physical or mental disability, veteran status, gender identity, or sexual orientation.
","[28, 51, 133, 19369]"
66151,2017-10-04T14:15:43,2017-10-04T10:37:07,QA Lead,SnapEngage,qa-lead-snapengage,http://berlinstartupjobs.com/engineering/qa-lead-snapengage/,"As QA Lead at SnapEngage, you will work with an agile, distributed, and passionate team to develop new and exciting features for our live chat and customer engagement platform that handles millions of requests each day. You will be integral to the quality of our product and along with the Director of Product Engineering lead the growth and management of the QA function.

You are an expert in modern testing techniques, tools and platforms in use in SAAS development and delivery. Including visual and functional testing with both manual and test automation experience. You are also be aware of best practice around unit, security, load and performance testing and able to advise on concepts such as TDD and BDD. You will be responsible for the quality of the output of the team as a whole and work alongside other senior technical team members to define the standards and processes that the rest of the test team work to.
You have at least 5 years commercial experience in web platform and software testing and are intimately familiar with testing a software-as-a-service product, preferably on the Java stack. Experience working with Google App Engine would be a significant advantage.
This is also a hands-on role where you will be involved in the end-to-end testing process, from developing test cases, running tests, tracking incidents, regression testing, closure and release.
As QA Lead you will be expected to:

Assist the Director of Product Engineering in structuring, managing and growing the team, and managing external test support as necessary
Assess our testing approach on an ongoing basis, identifying best implementation options for automated and manual testing and maintaining test plans and release processes to ensure quality across the platform.
Define and enforce the company’s quality standards, and to promote QA across the business
Triaging incoming bug reports from stakeholders and internal teams; verifying, classifying and detailing before passing to backlog
Researching and keeping us up to date with the latest trends in testing as it pertains to a SAAS platform
Contribute ideas to improve our service and software
Maintain a list of supported technologies (browsers etc)
Manage our test environments
Participate in daily stand-up meeting with our global team

On projects you will:

Interrogate feature specifications, user stories etc. and assist the Product Owner in defining Acceptance Criteria
Work as an integral part of the team, managing day-to-day test tasks and approving code for release
Execute test scripts, recording results to ensure that requirements have been met, and working with developers to resolve issues
Maintain the defect-tracking system (JIRA)
Manage your own time successfully, prioritise effectively
Work on multiple development streams at the same time
Hold final say on whether a task is “done done”

About you:

Fluent English speaker with excellent communication skills, at both a technical and non technical level
Have great interpersonal skills, stakeholder facing
Experience in implementing new testing tools and processes
Have experience working in an agile (Scrum) environment
Have experience with team / project planning
Have excellent time management and prioritisation skills
Demonstrable knowledge and experience of tools to supplement manual testing such as: Developer tools, REST/API/JSON tools
Demonstrable knowledge of third party testing solutions
Experience of Continuous integration and Test automation
Keen to understand how things are meant to behave and how things may go wrong
Keen to develop an understanding of the expectations of a product from a user or customer point of view
Be ambitious, proactive and self managing
Understanding of customer or technical support beneficial
Authorized to work in Berlin, Germany

Awesome Benefits:

Work with a multinational and multicultural team of talented and inspiring colleagues
Opportunity to make great ideas come to life!
Work from home up to 2 days a week
Open Book management
Yearly team building trip to exotic locations
Weekly German class at our office

About SnapEngage:
SnapEngage is a fast-growing live chat solution for the web. We are an Internet startup born of the TechStars program in Boulder, CO with offices in Boulder, USA and Berlin, Germany. All SnapEngage employees have a stake in the company’s success and enjoy an exceptional work-life balance. Our employees embrace a good challenge and enjoy providing the best customer service in the biz. SnapEngage is self-funded, profitable, and deeply committed to creating products that make people’s lives better by changing the way companies interact with their customers.
","[275, 1816, 2201]"
