job_id,published_on,updated_on,role,company,slug,link,description,tags
66379,2017-10-05T08:47:54,2017-10-05T07:46:25,Backend Software Engineering &#8211; all levels,99chairs,backend-software-engineering-all-levels-99chairs,http://berlinstartupjobs.com/engineering/backend-software-engineering-all-levels-99chairs/,"Are you looking for the next step in your career?
Then join our team of talented entrepreneurs right in the heart of the startup capital Berlin!
We believe in bringing happiness to people through interior designs that turn their homes and offices into places they love.
In our pursuit to innovate living, we deliver exceptional & affordable interior design solutions. Whether our clients are looking for design inspiration or want us to bring the ideas to life ourselves, we strive to make their experience as convenient & inspirational as humanly possible – and, by the way, that’s only where we start!
We pride ourselves in the service we deliver. And, we value the people that turn our mission into a reality. Our dream is to create a work environment that connects great talent, gives them the freedom to do great stuff and continuously supports opportunities for learning and growth. At 99chairs, colleagues turn into friends and goals are accomplished as a team.

The role

Help 99chairs build a robust and scalable backend API that enables our front-end applications (website and mobile).
Planning and development of back-end system with strong emphasis on code quality and structure.
Responsible for designing and architecturing the back-end application.
Dive into hard problems and successfully deliver great results on schedule
Work closely with product managers, designers & other engineering team members to roll out new features and improve existing ones.
Integration with 3rd Party APIs and systems.

Your skills and experience

Professional hands-on experience in software development specially back-end development.
Ability to write clean and modular code with emphasis on code quality.
Good experience writing automated unit and integration test cases.
Experience building and deploying complex web platforms and APIs.
Knowledge about the various software engineering practices,concepts and tools used in professional software development like code reviews, version control, build processes, continuous integration, test automation etc.
Our tech stack includes: Ruby, Ruby on Rails, ElasticSearch, Redis, Docker amongst other. Experience in these technologies (although not mandatory) is highly desirable.
Experience working in any Object Oriented language that’s used for web application development.
Ability to take ownership for your work and work independently.
Strong analytical and problem solving skills.

More reasons to work at 99chairs

A flat work environment with innovative decision making processes. We don’t just say this, but do our very best to make sure that everyone’s voice is being heard.
Flexible work hours and environment. As long as you get things done and are aligned with your team, you have complete autonomy over your work-life.
A kitchen fully stocked with healthy snacks & drinks as well as weekly team lunches.
A BVG ticket to brighten up your commute
The possibility to furnish your home with our amazing discount rates.

Are you the right fit?
We are looking for people that are smart entrepreneurs at heart, who love responsibility and bring projects and ideas forward – every single day. We love constant learners, team players, and people who agree that strong teams are built based on honesty!
Interested?
Then submit your application including cover letter, CV, grades and references by clicking on the button below. We can’t wait to get to know you!
*99chairs is an equal opportunity employer. Applicants are considered without regards to race, color, religion, national origin, age, sex, marital status, ancestry, physical or mental disability, veteran status, gender identity, or sexual orientation.
","[28, 51, 133, 19369]"
66386,2017-10-05T08:45:53,2017-10-05T07:45:07,Frontend Software Engineering- all levels,99chairs,frontend-software-engineering-all-levels-99chiars,http://berlinstartupjobs.com/engineering/frontend-software-engineering-all-levels-99chiars/,"Are you looking for the next step in your career?
Then join our team of talented entrepreneurs right in the heart of the startup capital Berlin!
We believe in bringing happiness to people through interior designs that turn their homes and offices into places they love.
In our pursuit to innovate living, we deliver exceptional & affordable interior design solutions. Whether our clients are looking for design inspiration or want us to bring the ideas to life ourselves, we strive to make their experience as convenient & inspirational as humanly possible – and, by the way, that’s only where we start!
We pride ourselves in the service we deliver. And, we value the people that turn our mission into a reality. Our dream is to create a work environment that connects great talent, gives them the freedom to do great stuff and continuously supports opportunities for learning and growth. At 99chairs, colleagues turn into friends and goals are accomplished as a team.

The role

Work closely with product managers, designers & other engineering team members to roll out new features and improve existing ones
Implement great client side UI, with focus on clean and modular code
Mentoring other team members and interns
Testing of the front-end code using Javascript tests
Keeping our application and libraries updated and using best engineering practices

Your skills & experience

You’re an expert with JavaScript, with focus on good code quality and principles
You know how to scale web platforms, including optimizations and browser or device specific adjustments
Experience with JS frameworks such as React
Comfortable with Git, Unix and dealing with REST-APIs
Our tech stack includes: Ruby on Rails, React, Node.js etc. Experience in these technologies (although not mandatory) is highly desirable.
Focused on building responsive interfaces
Always up-to-date with latest trends, tools and technologies in the front-end world
Experience with front-end testing using Jasmine, Karma etc.
Familiar with SEO principles
Hands-on experience working with backend tools and technologies such as Node.js or Ruby on Rails is a plus

More reasons to work at 99chairs

A flat work environment with innovative decision making processes. We don’t just say this, but do our very best to make sure that everyone’s voice is being heard.
Flexible work hours and environment. As long as you get things done and are aligned with your team, you have complete autonomy over your work-life.
A kitchen fully stocked with healthy snacks & drinks as well as weekly team lunches.
A BVG ticket to brighten up your commute
The possibility to furnish your home with our amazing discount rates.

Are you the right fit?
We are looking for people that are smart entrepreneurs at heart, who love responsibility and bring projects and ideas forward – every single day. We love constant learners, team players, and people who agree that strong teams are built based on honesty!
Interested?
Then submit your application including cover letter, CV, grades and references by clicking on the button below. We can’t wait to get to know you!
*99chairs is an equal opportunity employer. Applicants are considered without regards to race, color, religion, national origin, age, sex, marital status, ancestry, physical or mental disability, veteran status, gender identity, or sexual orientation.
","[28, 51, 133, 19369]"
66151,2017-10-04T14:15:43,2017-10-04T10:37:07,QA Lead,SnapEngage,qa-lead-snapengage,http://berlinstartupjobs.com/engineering/qa-lead-snapengage/,"As QA Lead at SnapEngage, you will work with an agile, distributed, and passionate team to develop new and exciting features for our live chat and customer engagement platform that handles millions of requests each day. You will be integral to the quality of our product and along with the Director of Product Engineering lead the growth and management of the QA function.

You are an expert in modern testing techniques, tools and platforms in use in SAAS development and delivery. Including visual and functional testing with both manual and test automation experience. You are also be aware of best practice around unit, security, load and performance testing and able to advise on concepts such as TDD and BDD. You will be responsible for the quality of the output of the team as a whole and work alongside other senior technical team members to define the standards and processes that the rest of the test team work to.
You have at least 5 years commercial experience in web platform and software testing and are intimately familiar with testing a software-as-a-service product, preferably on the Java stack. Experience working with Google App Engine would be a significant advantage.
This is also a hands-on role where you will be involved in the end-to-end testing process, from developing test cases, running tests, tracking incidents, regression testing, closure and release.
As QA Lead you will be expected to:

Assist the Director of Product Engineering in structuring, managing and growing the team, and managing external test support as necessary
Assess our testing approach on an ongoing basis, identifying best implementation options for automated and manual testing and maintaining test plans and release processes to ensure quality across the platform.
Define and enforce the company’s quality standards, and to promote QA across the business
Triaging incoming bug reports from stakeholders and internal teams; verifying, classifying and detailing before passing to backlog
Researching and keeping us up to date with the latest trends in testing as it pertains to a SAAS platform
Contribute ideas to improve our service and software
Maintain a list of supported technologies (browsers etc)
Manage our test environments
Participate in daily stand-up meeting with our global team

On projects you will:

Interrogate feature specifications, user stories etc. and assist the Product Owner in defining Acceptance Criteria
Work as an integral part of the team, managing day-to-day test tasks and approving code for release
Execute test scripts, recording results to ensure that requirements have been met, and working with developers to resolve issues
Maintain the defect-tracking system (JIRA)
Manage your own time successfully, prioritise effectively
Work on multiple development streams at the same time
Hold final say on whether a task is “done done”

About you:

Fluent English speaker with excellent communication skills, at both a technical and non technical level
Have great interpersonal skills, stakeholder facing
Experience in implementing new testing tools and processes
Have experience working in an agile (Scrum) environment
Have experience with team / project planning
Have excellent time management and prioritisation skills
Demonstrable knowledge and experience of tools to supplement manual testing such as: Developer tools, REST/API/JSON tools
Demonstrable knowledge of third party testing solutions
Experience of Continuous integration and Test automation
Keen to understand how things are meant to behave and how things may go wrong
Keen to develop an understanding of the expectations of a product from a user or customer point of view
Be ambitious, proactive and self managing
Understanding of customer or technical support beneficial
Authorized to work in Berlin, Germany

Awesome Benefits:

Work with a multinational and multicultural team of talented and inspiring colleagues
Opportunity to make great ideas come to life!
Work from home up to 2 days a week
Open Book management
Yearly team building trip to exotic locations
Weekly German class at our office

About SnapEngage:
SnapEngage is a fast-growing live chat solution for the web. We are an Internet startup born of the TechStars program in Boulder, CO with offices in Boulder, USA and Berlin, Germany. All SnapEngage employees have a stake in the company’s success and enjoy an exceptional work-life balance. Our employees embrace a good challenge and enjoy providing the best customer service in the biz. SnapEngage is self-funded, profitable, and deeply committed to creating products that make people’s lives better by changing the way companies interact with their customers.
","[275, 1816, 2201]"
66150,2017-10-04T14:11:43,2017-10-04T10:35:48,Senior Software Engineer (Java),SnapEngage,senior-software-engineer-java-snapengage,http://berlinstartupjobs.com/engineering/senior-software-engineer-java-snapengage/,"As a Senior Software Engineer at SnapEngage, you will work with a small, agile, distributed, and passionate team to develop new and exciting features and write highly scalable code for our live chat and customer engagement platform that handles millions of requests each day.

This position is a full-time Software Engineer based in our Berlin office.
Our senior engineers need to have deep technical knowledge as well as great leadership skills. You will be expected to have the ability to lead a team and work closely with our Product Owner to deliver solutions to a very high standard. You will have at least 4 years experience as a Java developer and be familiar with building for a SAAS platform (or similar large scale web apps). Demonstrable knowledge of Google App Engine would be a significant advantage.
As Senior Software Engineer you will:

Design and develop new, innovative, scalable services & APIs receiving millions of requests per day
Research new technologies and methodologies to improve our products and development workflow
Contribute ideas to improve our service and software
Maintain and improve existing functionality
Coach other developers with code reviews, pair programming, etc.
Occasionally take the Scrum Master responsibilities
Participate in daily stand-up meeting with our global team

On projects you will be:

Designing and developing new features for our customer admin dashboard and chat portal
Extending our analytics and real time event streaming platform
Developing and maintaining our real time web services, using Java servlets on Google AppEngine
Maintaining and developing new integrations with external CRMs and Help Desks (REST, JSON, XML)

About You:

4+ years of experience in Java programming, other languages a plus
3+ years experience developing large scale web applications
Fluent English speaker, other languages a plus
A quick learner, dedicated team player and have a relentless positive attitude
Experience writing clean, efficient and testable code, experience with TDD a plus
Experience with Google AppEngine and GWT a major plus
Knowledge of one or more JavaScript frameworks, D3 or Backbone a plus
Authorized to work in Berlin, Germany

Awesome Benefits:

Work with a multinational and multicultural team of talented and inspiring colleagues
Opportunity to make great ideas come to life!
Work from home up to 2 days a week
Open Book management
Yearly team building trip to exotic locations
Weekly German class at our office

About SnapEngage:
SnapEngage is a fast-growing live chat solution for the web. We are an Internet startup born of the TechStars program in Boulder, CO with offices in Boulder, USA and Berlin, Germany. All SnapEngage employees have a stake in the company’s success and enjoy an exceptional work-life balance. Our employees embrace a good challenge and enjoy providing the best customer service in the biz. SnapEngage is self-funded, profitable, and deeply committed to creating products that make people’s lives better by changing the way companies interact with their customers.
","[58, 1599, 2116, 2201]"
66073,2017-10-04T13:45:36,2017-10-04T10:33:13,Lead Engineer,Flowigo,lead-engineer-flowigo,http://berlinstartupjobs.com/engineering/lead-engineer-flowigo/,"Do you believe in Social Entrepreneurship, where our generation applies its talent to solve our planet’s most important problems?
Do you believe in digital technology that leads rapid and positive transformation across a continent?
Let’s talk :)
Africa is on the path of building a more sustainable and equal future and we think Digital Technology is the best channel to accelerate this trend. Our customers are African businesses distributing solar systems, agriculture products, health insurance or financial services to the populations which need them most. We provide the underlying foundation to digitalize their businesses and power their growth.
No need to re-invent the wheel. Hundreds of applications exist and are getting better-and-better at solving local businesses’ challenges: sending/receiving Payments, sending/receiving SMS, IoT, Customer tracking, Reporting, Invoicing…. We build the integrations and help businesses run the show from one integrated platform.
We aim at building Africa’s largest network of applications to bring barriers down and help data flow.
Your role is to:

Build and maintain Africa’s fastest growing network of Services.
Handle numerous databases and ensure that data keeps flowing!
Solve exciting tech challenges to enable modularity, scalability and security.

What we expect:

Expertise in cloud database management (AWS, MySQL, PostgreSQL)
Good track-record with App integrations (Restful APIs, RAML) and data transformation (ETLs)
Experience developing web apps with Python, Java.
Experience with Zapier or other Micro-services platforms (Mulesoft).
Strong analytical and debugging skills.
Self-management, diligence and strong communication skills.

What we offer:

A high impact opportunity where your work will truly matter to local communities regional development.
A very fast pace environment with a ton of room for learning and further developing your skill set (Project Management, Technical abilities, Leadership).
No hierarchies and the opportunity to directly work with the founder and the whole team.
A fair salary.

","[17, 1660, 2381, 7040, 21143]"
66072,2017-10-04T13:22:34,2017-10-04T10:29:02,"Webentwickler (m/w) (PHP, MySQL, JS, HTML5, CSS3)",ReachHero,webentwickler-mw-php-mysql-js-html5-css3-reachhero,http://berlinstartupjobs.com/engineering/webentwickler-mw-php-mysql-js-html5-css3-reachhero/,"Als Deutschlands größte Plattform für Influencer Marketing bringen wir Influencer und Unternehmen glücklich zusammen. Um dies in Zukunft noch besser zu schaffen, suchen wir einen Programmierer, der unseren Erfolg mitgestalten und seine Ideen einbringen möchte. Rocke mit unseren Entwicklern die Gestaltung, Weiterentwicklung und Optimierung unserer Internet-Plattform auf Basis von PHP und MySQL, sowie JS, HTML5, CSS3. Natürlich immer mit viel Engagement, Teamgeist und guter Laune – wir sind ein junges & dynamisches Team in typischer Start-Up Atmosphäre.


Über ReachHero:
Wir sind Deutschlands größte Plattform für Influencer Marketing und bringen Influencer und Unternehmen glücklich zusammen. Daher legen wir besonders viel Wert darauf, unsere Partnerunternehmen rundherum zufrieden zu stellen! Um dies in Zukunft noch besser zu schaffen, suchen wir einen Programmierer, der unseren Erfolg mitgestalten und seine Ideen einbringen möchte. Natürlich immer mit viel Engagement, Teamgeist und guter Laune – wir sind ein junges & dynamisches Team in typischer Start-Up Atmosphäre. Kreativ, hohes Tempo, kurze Entscheidungswege.
Dein Aufgabenbereich:
Rocke mit unseren Entwicklern die Gestaltung, Weiterentwicklung und Optimierung unserer Internet-Plattform auf Basis von PHP und MySQL, sowie JS, HTML5, CSS3.
Dazu gehören folgende Aufgaben:

Weiterentwicklung einer PHP-Webapplikation
Entwicklung, Design und Programmierung neuer Applikationen im PHP-Umfeld
Problemanalyse und -lösung
Testen (Q&A) von neu entwickelten Softwaremodulen
Frontend & Backend Entwicklung

Du solltest eine aufgeschlossene Persönlichkeit haben und in der Lage sein, Fragestellungen und Probleme effizient zu lösen.
Qualifikation:

Rockstar in PHP, HTML5, CSS3 und jQuery, sowie MySQL
Erste Bootstrap-Framework und mobile development Erfahrungen
Spaß und Kreativität beim Lösen von schwierigen Programmierproblemen
Gute Kommunikationsfähigkeiten
FIFA 2016 Skills wünschenswert ;)

Das erwartet dich:
Unser Office befindet sich im Prenzlauer Berg im wunderschönen Winsviertel, inmitten von vielen Cafes und Restaurants. Von hier aus betreuen wir unsere Kunden und Influencer. Ob Playstation, Teamevents, Getränke oder Frühstück & Obst for free – eine gute Arbeitsatmosphäre ist uns genauso wichtig, wie gutes Teamwork.
Haben wir dein Interesse geweckt? Dann freuen wir uns auf deine Bewerbung!
Bewirb dich bitte mit Anschreiben, Lebenslauf, frühstmöglichem Eintrittstermin & Gehaltsvorstellung in einer Mail an Annika: annika@reachhero.de
","[18, 25, 948, 3500]"
66068,2017-10-04T12:45:28,2017-10-04T10:22:34,Big Data Engineer (m/f),HelloFresh,big-data-engineer-mf-hellofresh,http://berlinstartupjobs.com/engineering/big-data-engineer-mf-hellofresh/,"At HelloFresh, we want to change the way people eat. Over the past 5 years we’ve seen this mission spread beyond our wildest dreams. So, how did we do it? Our weekly recipe boxes full of exciting recipes and lovingly sourced, fresh ingredients have blossomed into a community of inspired, energised home cooks that expands across the globe. We’re now active and growing in 9 different countries in 3 continents.
Our story started in Berlin. As Europe’s tech hub, and the home of our global headquarters, it’s a dynamic, progressive environment where innovation is nurtured and promoted. Since we started, we’ve worked exceptionally hard and we’ve more than US$ 350 million in investment which together have allowed us to create an award winning product and become one of the top 3 largest companies to come out of Europe over the past 4 years.
As a member of HelloTech you’ll be exposed to a modern technology stack and a slick cross functional agile team setup. We have developed a refined product and provide scalability on a global level. Join our HelloTech team and help us to build a fresh food global champion!


About the job
As a Big Data Engineer at HelloFresh, you will be collaborating to build one of the most advanced big data platforms in Europe. You will develop distributed services that processes data in near-time and real-time, with focus on scalability, data quality and integration of machine learning models.

Plan, Implement and maintain distributed, service-oriented and message-oriented data platform components
Design, build, and maintain data ingestion, ETLs and infrastructure for batch and near real time processing.
Build and maintain Business Intelligence and reporting solutions.

You can get a taste of what we’ve been working on by checking out our engineering blog.
Who we’re looking for

Degree in Computer Science, Software Engineering, or equivalent
Experience in Software Engineering
Fluency in Python and OOP
Experience with Apache Spark, Hive, Impala, and Kafka
Experience with Hadoop, plus distributions like Cloudera, MapR or Hortonworks
Experience with RDBMS such as PostgreSQL or MySQL
Experience with NoSQL data stores such as MongoDB, Redis or Cassandra
Agile team-working experience
Test-Driven Development
Preferred: Experienced with data modelling, design patterns, building highly scalable and secured solutions
Preferred: Experience with Amazon AWS and DevOps and Automation
Preferred: Familiarity with performance metric tools
Preferred: Knowledge of visualization tools (Tableau, Qlikview)

What we offer

The opportunity to get into one of the most intellectually demanding roles at one of the largest technology companies in Europe
Cutting edge technology, allowing you to work with state-of-the-art tools and software solutions
Competitive compensation and plenty of room for personal growth
Great international exposure and team atmosphere
Work in a modern, spacious office in the heart of Berlin with excellent transport links and employee perks

Are you up for a challenge?
Please submit your complete application below including your earliest starting date and salary expectations.
We’re committed to making HelloFresh as inclusive as we can be. As part of that commitment we chose to be transparent about our diversity data. To enable us to build an accurate picture of our workforce, we ask some optional questions in our application process.
","[33, 65, 560, 3559, 5202]"
