job_id,published_on,updated_on,role,company,slug,link,description,tags
69018,2017-10-13T08:50:26,2017-10-13T06:58:44,Identity Management Engineer (SSO),Market Logic Software,identity-management-engineer-sso-market-logic-software,http://berlinstartupjobs.com/engineering/identity-management-engineer-sso-market-logic-software/,"The Market Logic Engineering team is looking for an experienced and highly motivated Identity Management Engineer to work full time in our Berlin office.
About Market Logic
Too much data, not enough insights! Companies invest millions in market research, syndicated data, social media, analytics, etc. to understand consumers and monitor business performance. But reuse of past research and systematic knowledge-building is rare. Market Logic is a software company that’s changing the way companies build consumer understanding and use it in innovation, marketing and sales. It’s the platform for the CMO and VP Insights to truly become a consumer-centric organization. That’s why our marketing information systems are used by global brands like Unilever, Coca-Cola, Johnson & Johnson and many more in verticals like CPG/FMCG, Finance, Healthcare, Retail, Telecom, and more.
We are a young and fresh team. Walk around our headquarters in Berlin, Germany and you’ll see an open multi-cultural environment, where co-workers talk passionately about how to transform innovation, marketing, and sales. Every Market Logicer believes that market research and consumer data should be more effective and that software can make it easier to manage and far more powerful.
The Identity Management Engineer will be responsible for the implementation and validation of all SSO integration activities, ongoing routine maintenance of SSO integrations and infrastructure.
This position is primarily responsible for the integration and management of reliable and stable Single Sign-on infrastructure of Market Logic Software internally and externally.
Your Tasks:

Work on Single Sign-On/Identity Management Engineering
Enable Single Sign-On between our customers, partners and Market Logic platform
Collaborate with a team of Engineers/Project Managers on various projects
Work alongside development and product management teams to further develop Market Logic platform

Your Profile:

7+ years of direct hands-on experience with Identity Management technologies including integration, provisioning and configuration
Experience building out internal and external SAML connections
Federated Identity Management experience, experience in OpenAM is highly desirable
Strong hands-on development experience in Java/J2EE, Web Service and RESTful service technologies
Experience in HTML, HTML5, CSS, JSON, XML, JavaScript, Ajax, Angular, JQuery and others
Previous SaaS experience is strongly preferred
Ability to work on multiple assignments simultaneously and ensure design and coding are adhering to security, architectural and documentation standards
Strong understanding of a development organization and the SDLC cycle
Deep understanding of change management procedures/protocols and documentation
Strong verbal and written communication skills are desired
Flexibility to work during the designated change windows including nights/weekends

Benefits:

Work in an entrepreneurial, fast growing and successful business environment
Join an agile team in implementing complex features with modern technologies
Performance-oriented remuneration
An experienced, professional team with flat hierarchies
Daily fresh fruit, German classes, kicker table, recreation room complete with an Xbox
Various team events throughout the year

","[1136, 15161, 20697]"
69017,2017-10-13T08:40:24,2017-10-13T06:57:43,Senior iOS Engineer,incapptic Connect GmbH,senior-ios-engineer-incapptic-connect-gmbh,http://berlinstartupjobs.com/engineering/senior-ios-engineer-incapptic-connect-gmbh/,"incapptic Connect automates the mobile app release process improving speed and efficiency. The software solution is a Mobile Center of Excellence (MCoE) in a box, and combines self-service and automation to enable new apps to be launched, and existing ones updated or renewed automatically at the click of a button. World class companies like CLAAS, Deutsche Lufthansa, or Schindler use incapptic Connect software to achieve fast and frequent releases while reducing process costs.


For our development team in Berlin we are looking for an Senior iOS Engineer, who can:

Work from our betahaus office in Berlin and be a valuable member of our growing team
Develop and improve one technological core of our product: the integrated automatic app signer for iOS and Android
Work both as a mobile iOS engineer as well as a Full Stack developer.

Skills & Requirements:

At least 2 years experience as an iOS DevOps expert or iOS developer
Sound knowledge in iOS Code Signing
Solid Python knowledge and web development experience
Good communication skills in English
Happy to support us on-site in Berlin.

","[65, 66, 93, 1924, 3500]"
69015,2017-10-13T08:40:22,2017-10-13T06:33:48,Solutions Architect (Europe),data Artisans,solutions-architect-europe-data-artisans,http://berlinstartupjobs.com/engineering/solutions-architect-europe-data-artisans/,"Data stream processing is redefining what’s possible in the world of data-driven applications and services. Apache Flink is one of the systems at the forefront of this development, pushing the boundaries of what can be achieved with data stream processing.
Apache Flink currently powers some of the largest data stream processing pipelines in the world, with users such as Alibaba, Uber, ING, Netflix, and more running Flink in production. Flink is also one of the most active and fastest-growing open source projects in the Apache Software Foundation.
data Artisans was founded in 2014 by the original creators of the Apache Flink project, and we’re building the next-generation platform for real-time data applications. We are tackling some of today’s biggest challenges in big data and data streaming.

Your role:
data Artisans is currently building a new team of Solution Architects in Europe and the US. You’ll be part of a new and fast-growing team helping customers having a great experience using our products and Apache Flink. The role will sit at the forefront of one of the most significant paradigm shifts in information processing and real-time architectures in recent history – stream processing – which sets the foundation to transform companies and industries for the on-demand services era.
You will work with engineering teams inside of our customers to build the best possible stream processing architecture for their use cases. This includes reviewing their architecture, giving guidance on how they design their Flink applications, and helping them take their first steps with our products.
Some of the customer engagements will be carried out remotely via phone and screen share, but the position also includes traveling to customers to help them onsite.
And when you’re not working with our customers, there are plenty of opportunities at data Artisans to learn more about Flink, contribute to the products and open source projects, and help evangelizing Apache Flink to users around the world.
What you’ll do all day:

Use your experience to solve challenging data engineering and stream processing problems for our customers
Meet with customers, understand their requirements, and help guide them towards best-of-breed architectures
Provide guidance and coding assistance during the implementation phase and make sure projects end in successful production deployments
Become an Apache Flink and stream processing expert

You will love this job if you …
… are experienced in building and operating solutions using distributed data processing systems on large scale production environments (e.g. Hadoop, Kafka, Flink, Spark)
… are fluent in Java and/or Scala
… love to spend the whole day talking about Big Data technologies
… have great English skills and like talking to customers
… like traveling around the Europe/USA and visiting new places
What we offer:

Competitive salary and stock options
Tech gear of your choice
International team environment (10 nationalities so far)
Flexible working arrangements (home office, flexible working hours)
Unlimited vacation policy, so take time off when you need it
Spacious office space in the Kreuzberg district of Berlin
Snacks, coffee and beverages in the office
Relocation assistance if needed
Hackathons and weekly technical Lunch Talks to keep your head full of inspirations and ideas!

","[560, 3574, 5202, 6029, 16572]"
68898,2017-10-13T08:05:15,2017-10-13T06:27:38,Senior QA Engineer (m/f),HeyJobs,senior-qa-engineer-mf-heyjobs,http://berlinstartupjobs.com/engineering/senior-qa-engineer-mf-heyjobs/,"HeyJobs mission is to leverage data & technology to make recruiting 10x more efficient and effective. By applying best practices from the online marketing world to recruiting, we help our clients win talent at scale.
We are growing our team and looking for a Senior QA Engineer (m/f) to join our experienced and talented Development Team. An exciting opportunity for you to join HeyJobs.

Your responsibilities: 

Take ownership of our complete test strategy comprising both manual and automated tests
Be an advocate for quality and drive improvements to the quality of our frontend and backend applications
Improve and add to our existing continuous integration pipeline built on CircleCI
Design, develop, execute, and maintain test plans
Building automated testing as well as developing automated scenarios/scripts
Actively find and report bugs to product and development team

Your profile: 

Minimum of 2-3 years of experience in manual testing and QA test automation
Comfortable working with browser based, functional testing (e.g. WDIO or Selenium)
Experience with Ruby, JavaScript or similar programming languages
Experience with source code controls like Git
Familiarity with continuous integration/delivery and tooling (e.g. Circle CI/Travis CI)
Experience in agile methodologies
Self-starter and an entrepreneurial mind

What we offer: 

An important and shaping role in a fast-growing company, very close to highly experienced team members which will mentor you
A fast-paced environment with work which will have a direct impact on HeyJobs
An amazing team culture with regular team and company events
A feedback-seeking culture that helps your professional and personal growth
A super transparent information policy with flat hierarchies
Amazing office in Berlin Kreuzberg with lots of room for individual development

Interested?
Send us your CV and we will get back to you as soon as possible.
We are looking forward to your application!
Are you interested in the company culture at HeyJobs? Have a look at our ratings at Glassdoor!
","[275, 2117, 3658, 21214]"
68825,2017-10-12T14:30:42,2017-10-12T13:40:22,Scala IoT Developer (m/f),relayr,scala-iot-developer-mf-relayr,http://berlinstartupjobs.com/engineering/scala-iot-developer-mf-relayr/,"Join a team that values automation, low-friction processes and developer driven decisions!
relayr has become Europe’s leading platform for the Internet of Things, enabling the interaction between diverse systems, and creating new scenarios in which we interact with the world around us. If you would like to work with a great team and technology to build the infrastructure for the next generation of connected devices…
Then relayr is the right place for you!

We are looking to recruit a diverse group to be able to best handle the diverse problems in the emerging market of Internet of Things.
As a Scala IoT Developer you would be able to design and implement new features for our platform (Scala, REST Services, Akka, PostgreSQL, Cassandra, Kafka, etc.), build data streaming / analytics infrastructure (i.e. on Apache Flink) and work on scalability / performance problems. You will join our backend team in Berlin.
Your Tasks:

Design, develop and maintain a wide range of Scala microservices for our growing IoT platform
Add value with every iteration to help us move quickly
Take initiatives on new technologies, ideas and approaches
Help mould our leading-edge stack and processes
Bring creative engineering solutions to a challenging distributed system
Help to design a universal and usable API for IoT
Collaborate with colleagues in a fluid, cross-functional team environment

Your Skills:

Minimum 2+ years experience on challenging server-side projects, ideally on JVM platform.
Expertise in building REST APIs, distributed systems. (eg: Swagger, Akka HTTP, Kafka)
Ideally some exposure to data related frameworks and tools. (eg: Spark, Flink)
Experience with SQL and NoSQL databases. (eg: PostgreSQL, Cassandra, Elasticsearch)
Comfortable working with linux systems and DevOps. (eg: Docker, Jenkins, AWS)
Able to work in a structured, agile, test oriented manner.

We Offer:

Flexible office environment
A diverse and friendly team with people from all over the world, speaking 20+ languages, of all ages and parental-status
Connecting you with a network of companies and people from around the globe
A learning environment where you can extend and build upon your skills and interests, as well as knowledge-sharing and an expanding library of books
Opportunities to attend events and conferences pertaining to your discipline
Competitive Salary and Stock Options
Cool office located in Kreuzberg with a relaxation room, standing-desks, 3D printer and free fruit and drinks
Free German courses at intermediate and advanced level (Working language is English)
We offer the ability to work in a cutting-edge field with the best people in the IoT industry!

Sounds interesting? Please follow the link to apply for this position: https://relayr.bamboohr.co.uk/jobs/view.php?id=38
","[21, 201, 1373, 2509, 4060]"
68824,2017-10-12T14:08:39,2017-10-12T13:17:23,NodeJS Developer (m/f),relayr,nodejs-developer-mf-relayr,http://berlinstartupjobs.com/engineering/nodejs-developer-mf-relayr/,"Join a team that values automation, low-friction processes and developer driven decisions!
relayr has become Europe’s leading platform for the Internet of Things, enabling the interaction between diverse systems, and creating new scenarios in which we interact with the world around us. If you would like to work with a great team and technology to build the infrastructure for the next generation of connected devices…
Then relayr is the right place for you!

We are looking to recruit a diverse group to be able to best handle the diverse problems in the emerging market of Internet of Things. Currently we are seeking Node.js developers to join our Backend team in Berlin.
Your Tasks:

Design, develop and maintain a wide range of Node.js microservices for our growing IoT platform
Add value with every iteration to help us move quickly
Take initiatives on new technologies, ideas and approaches
Help mould our leading-edge stack and processes
Bring creative engineering solutions to a challenging distributed system
Help to design a universal and usable API for IoT
Collaborate with colleagues in a fluid, cross-functional team environment

Your Skills:

Minimum 3+ years experience in backend engineering, particularly in Node.js.
Expertise in building REST APIs, distributed systems. (eg: Swagger, Koa, Kafka, MQTT, OAuth 2.0)
Experience with SQL and NoSQL databases. (eg: PostgreSQL, Cassandra, Elasticsearch)
Comfortable working with Unix-like systems and DevOps. (eg: Docker, Jenkins, AWS)
Able to work in a structured, agile, test-oriented manner.

We Offer:

Flexible office environment
A diverse and friendly team with people from all over the world, speaking 20+ languages, of all ages and parental-status
Connecting you with a network of companies and people from around the globe
A learning environment where you can extend and build upon your skills and interests, as well as knowledge-sharing and an expanding library of books
Opportunities to attend events and conferences pertaining to your discipline
Competitive Salary and Stock Options
Cool office located in Kreuzberg with a relaxation room, standing-desks, 3D printer and free fruit and drinks
Free German courses at intermediate and advanced level (Working language is English)
We offer the ability to work in a cutting-edge field with the best people in the IoT industry!

Sounds interesting? Please follow the link to apply for this position:
https://relayr.bamboohr.co.uk/jobs/view.php?id=39
","[21, 60, 470, 4039]"
68722,2017-10-12T13:22:03,2017-10-12T10:14:54,Backend Developer &#8211; PropTech (m/f),realXdata,backend-developer-proptech-mf-realxdata,http://berlinstartupjobs.com/engineering/backend-developer-proptech-mf-realxdata/,"We’re looking for a curious and passionate for technology person, someone positive who loves to learn, someone who has already developed several web applications and knows everything from designing architectures to running them in production.

We are creating a unique data exchange model to develop the foremost lease-data platform in the world. Our platform is used by landlords to compare properties, lenders to underwrite loans, hedge funds to make investments, brokers to close deals and the media to track real estate trends. Be part of our journey to digitalize the real estate market and become part of realxdata’s team.
{WHAT YOU WILL DO / RESPONSIBILITIES} IN THE ROLE AS SENIOR BACKEND DEVELOPER:

Responsible for architecture, technology stack and implementation of our existing and future applications.
Collaborate to lead the development. The position offers the chance to become a Lead Developer.
Contribute to continuous improvement by suggesting improvements to all aspects of the product development.
Learn, train and develop yourself. Learn continuously and adapt continuously.
Requirements
BS/MS degree in Computer Science, Mathematics, Engineering or a related subject.
3+ years of web software development experience.
Solid understanding of the full web development life cycle and knowledge of designing patterns.
Proven software back-end development experience (E.g. Ruby, Python, Java/Scala)
Experience with relational databases (E.g. PostgreSQL, MySQL, Oracle) and NoSQL databases (E.g. MongoDB, CouchDB, Cassandra)
Experience with agile engineering practices such as TDD, BDD and CI/CD.
Analytical and problem solving skills. Fluency in English. German is a plus.
A great sense of humor, teamwork skills, and the ability to collaborate with co-workers.

BONUS POINTS

Experience building APIs and knowledge of RESTful principles
Experience deploying cloud infrastructures (AWS/Heroku)
Experience, knowledge or interest to learn Blockchain technologies.
Experience, knowledge or interest to learn Data Encryption technologies (homomorphic, transparent encryption, kerberos,..)

WHAT WE OFFER FOR YOU AS DATA SENIOR BACKEND DEVELOPER:

A challenging project that will significantly improve existing industry processes.
Coaching and mentoring. We’ll commit to helping you learn and grow.
A dynamic start-up environment with flat hierarchies, short decision-making processes in which everyone makes a difference and significantly contributes to our product and growth.
Loft-style office in Berlin Kreuzberg and excellent network of successful entrepreneurs.

","[17, 893, 1806, 1857, 6643]"
68676,2017-10-12T13:15:01,2017-10-12T10:14:33,Senior Big Data Developer (Scala) (f/m),adsquare GmbH,senior-big-data-developer-scala-fm-adsquare-gmbh,http://berlinstartupjobs.com/engineering/senior-big-data-developer-scala-fm-adsquare-gmbh/,"This is truly a chance of a lifetime. At adsquare you will be part of a rapidly growing ad tech startup that will add a totally new dimension to the world of mobile advertising. With our data exchange platform, we enable contextual and relevant advertising experiences through online and offline data sources to deliver valuable audience insights.
Due to the technicality of our solution, we at adsquare provide you with a great opportunity to dive into a developer role that will have you solve a great deal of exciting “problems” from day one. As our API has to be low-latency (normally responses

Requirements
We use SCALA and AKKA in combination with Spark/Spark Streaming and Cassandra for data architecture, and we expect our ideal candidate to be on top of those technologies, and even be able to teach us a thing or two. A good understanding of Big Data, efficient data structures and low latency programming are a must for this role, as they are the foundations of our market leading solution.

Expert level JVM development skills, with fluency in both Scala and Java.
Experience with using big data solutions like Cassandra, AKKA, Spark (Spark Streaming), HDFS and Kafka in a production environment.
Full lifecycle development experience building high throughput/low latency architectures
Test-Driven Development (Unit, Integration)
Continuous Integration knowledge (GIT, Gradle/Maven, CI-System, Docker etc.) is a plus
Deep understanding of distributed systems
Solid foundation in computer science fundamentals from data structures and algorithms to high-level design patterns
Keen to analyse architecture and software design in terms of scalability, testability and maintenance as well as develop optimization recommendations
Very good spoken and written English, ideally also German

Our Offer

A high level of responsibility from the very first day
Work closely with and lead other development team members
Agile, focused, yet relaxed atmosphere with flexible working hours
Competitive compensation package
And… a large reservoir of free drinks, snacks and fruits!

Interested?
If you are looking for a challenging position in a fast-moving tech-startup and want to make a difference you shouldn’t think twice and send your full application in English or German to jobs@adsquare.com.
adsquare Interview Tips

Preparation, curiosity and an open mindset make a great first impression on us
Creative CVs, preppy style and fluffy self-promotion bore us to tears

",[]
68675,2017-10-12T13:07:00,2017-10-12T10:14:08,Data Scientist/Analyst (f/m),adsquare GmbH,data-scientistanalyst-fm-adsquare-gmbh,http://berlinstartupjobs.com/engineering/data-scientistanalyst-fm-adsquare-gmbh/,"This is truly a chance of a lifetime. At adsquare you will be part of a rapidly growing ad tech startup that will add a totally new dimension to the world of mobile advertising. With our data exchange platform, we enable contextual and relevant advertising experiences through online and offline data sources to deliver valuable audience insights.
You will analyse large amounts of often unstructured, unrelated data from various sources (incl. hyperlocal data sources) to improve the quality and build new intelligent features for our marketplace. Thereby, you will work conceptually with the product team, develop advanced algorithms, methodologies together with our data scientists and collaborate with our software team to bring solutions into production.

Your Responsibilities

Raw data analysis – assessing quality and content, cleansing, structuring for downstream processing
Apply statistical-modelling/machine-learning to a variety of optimization and prediction problems
Design and prototype of accurate and scalable data science solutions to extract actionable intelligence
Test, cross-validate, and determine the precision and limitations of data science solutions
Present quantitative and qualitative results clearly to data science experts as well as be able to explain the results to top-level management
Functional and technical documentation
Collaboration with our software development team to implement solutions into production environment
Collaborate closely with our product team in solving business problems, and developing data-driven concepts
Oversight of production systems – monitor accuracy and performance, resolve issues

Your Skills

Experience in intelligent data analysis (applied machine learning, regression, classification and unsupervised approaches)
Cross validation and AB testing, design of experiments
Expertise in data-science using
Python + related data analysis packages – scipy, pandas, scikit-learn, etc. and/or
R/Matlab/Octave
ML Tools/LiIBS like Weka, Shogun, LibSVM, LibLinear
Visualization tools – e.g. matplotlib, or with R/Matlab
Java or Scala skills are very desirable
NOSQL, MongoDB, Hadoop and related systems
Strong analytical background and problem solving skills are desirable (computer science, mathematics, natural sciences, formal methods, etc.)
Solid coding skills enabling building of small scripts and applications to implement support personal analytical work and develop prototypes
Ability to communicate technical topics to non-technical individuals in English

Your Education and Experience

Master Degree or PhD in Engineering/ Physics / Machine Learning / Statistics / Applied Math / Computer Science, related field or equivalent work experience required
1+ years job experience

Our Offer

A high level of responsibility from the very first day
Closely work with and lead other development team members
Help building a great platform that will make a difference to Mobile Advertising
Agile, focused, yet relaxed atmosphere with flexible working hours
And… a large reservoir of free drinks, snacks and fruits!

Interested?
If you are looking for a challenging position in a fast-moving tech-startup and want to make a difference you shouldn’t think twice and send your full application in English or German to jobs@adsquare.com.
adsquare Interview Tips

Preparation, curiosity and an open mindset make a great first impression on us
Creative CVs, preppy style and fluffy self-promotion bore us to tears

",[]
